{
  "version": "0.4.0",
  "proposal_id": "CP-M4-004",
  "request_id": "UML-CASE-004",
  "base_configuration_id": "GOLD-CHG-HOSP-002",
  "base_architecture_hash": "0000000000000000000000000000000000000000000000000000000000000000",
  "origin_uml": {
    "model_id": "UML-ARCH-CHG-HOSP-002-STALE",
    "model_path": "paispl-m2/generated/CHG-HOSP-002.component.puml",
    "element_ids": ["CMP-LIS"]
  },
  "edit_type": "addition",
  "rationale": "오래된 UML 모델에서 LIS 연계를 추가한다.",
  "operations": [
    {
      "operation_id": "CPO-001",
      "kind": "include_feature",
      "source_id": "CMP-LIS",
      "target_id": "lis_integration",
      "source_quote": "LIS 연계를 추가한다."
    }
  ],
  "proposer": {"id": "M4-FIXTURE-AUTHOR", "type": "test_fixture"},
  "created_at": "2026-09-22T01:03:00Z",
  "status": "DRAFT",
  "required_approval_policy": "human-explicit-v1"
}
